<!ENTITY % t "(#PCDATA)" >
<!ELEMENT vuelos (panel_aeropuerto, vuelo+, panel_fecha)>
<!ELEMENT vuelo (Diario?, Origen, Destino, Hora_salida, Hora_llegada)>
    <!ATTLIST vuelo CÃ³digo ID #REQUIRED>
<!ELEMENT panel_aeropuerto %t;>
<!ELEMENT Diario EMPTY>
<!ELEMENT Origen %t;>
<!ELEMENT Destino %t;>
<!ELEMENT Hora_salida %t;>
<!ELEMENT Hora_llegada %t;>
<!ELEMENT panel_fecha %t;>